<?xml version="1.0" encoding="UTF-8"?>
<!-- <!DOCTYPE weather_observation SYSTEM "information.dtd"> -->
<weather_observation xmlns="https://www.w3schools.com"
xmlns:xsi="http://www.w3.org/2001/XMLSchema-instance"
xsi:schemaLocation="https://www.w3schools.com weather-schema.xsd">
    <locations>
        <location>
            <city>Las Palmas de G.C.</city>
            <lactitude cardinal-point="N">28.07</lactitude>
            <logintude cardinal-point="O">15.43</logintude>
            <observation>
                <date>2026-01-18 00:00:00</date>
                <temperature unit="celsius">17.1</temperature>
                <humidity>68</humidity>
                <wind_speed unit="km/h">32</wind_speed>
                <condition>Rain</condition>
            </observation>
        </location>
        <location>
            <city>Tenerife</city>
            <lactitude cardinal-point="N">28.16</lactitude>
            <logintude cardinal-point="O">16.36</logintude>
            <observation>
                <date>2026-01-18 00:00:00</date>
                <temperature unit="celsius">13.5</temperature>
                <humidity>77</humidity>
                <wind_speed unit="km/h">27</wind_speed>
                <condition></condition>
            </observation>
        </location>
    </locations>
</weather_observation>


<!-- xmlns="https://www.w3schools.com"
xmlns:xsi="http://www.w3.org/2001/XMLSchema-instance"
xsi:schemaLocation="https://www.w3schools.com weather-schema.xsd" -->